<?xml version='1.0' encoding='euc-kr'?>

<!-- protocolName='db1' -->
<transaction name='insert' xmlns="http://www.cyber-i.com/xml/bld"
	xmlns:xsi="http://www.w3.org/2001/XMLSchema-instance"
	xsi:schemaLocation="http://www.cyber-i.com/xml/bld   http://www.cyber-i.com/xml/ns/bld-5.0.xsd">



	<processor-info type='dbms' datasource=''>
		<transaction-type>rollback</transaction-type>

		<sql id='1'>
			<query>SELECT NVL(MAX(no),0)+1 FROM xbrl_instance</query>
			<mapping>
				<setProperty></setProperty>
				<getProperty>no</getProperty><!-- seq -->
			</mapping>
		</sql>

		<sql id='run1'>
			<query type="storedprocedure">

DECLARE
  poXML CLOB;
  

BEGIN
  poXML := '$xbrl';
  
  INSERT INTO xbrl_instance (no,code,version,company,xbrl,  create_date,create_time)
	        VALUES ($seq,?,?,?,XMLTYPE(poXML),to_char(sysdate,'YYMMDD'),to_char(sysdate,'HHMISS'));
END;

	        
	        </query>
			<mapping>
				<setProperty>code,version,company</setProperty>
				<getProperty></getProperty>
			</mapping>
		</sql>


	</processor-info>


	<input>
		<block>

			<field name="code" type="string" />
			<field name="version" type="string" />
			<field name="company" type="string" />
			<field name="xbrl" type="string" />
			<field name="style_xbrl" type="string" />
		</block>
	</input>

	<output>
		<block>
			<field name="seq" type="string" />
		</block>
	</output>

</transaction>

