<?xml version="1.0" encoding="UTF-8" ?>

<transaction name=""  xmlns="http://www.cyber-i.com/xml/bld"
	xmlns:xsi="http://www.w3.org/2001/XMLSchema-instance"
	xsi:schemaLocation="http://www.cyber-i.com/xml/bld   http://www.cyber-i.com/xml/ns/bld-5.0.xsd">
  <info>
    <name>list</name>
    <description>댓글관련 리스트</description>
    <author>김소영</author>
    <version></version>
    <http-access>true</http-access>
  </info>
  
  <processor-info type="dbms" datasource="ksyboard">
    <script language="java" import="">
        if(input.get("id") != "" &amp;&amp; input.get("mno") != "") {
          executeSQL("listCharge", connection, input, output);
          executeSQL("listId", connection, input, output);
          executeSQL("listReviewRight", connection, input, output);
        } else if(input.get("startRow") != ""){
          executeSQL("listComments", connection, input, output);
          executeSQL("listCount", connection, input, output);
        }
    </script>
    <transaction-type></transaction-type>
    <sql id="listCharge">
      <query>
        <![CDATA[
          SELECT id, mno FROM seat WHERE id LIKE '${id}' AND mno LIKE :mno
        ]]>
      </query>
      <mapping>
        <setProperty></setProperty>
        <getProperty>id, mno</getProperty>
      </mapping>
    </sql>
    <sql id="listComments">
      <query>
          <![CDATA[
             SELECT rnum, cmo, mno, id, grade, content, TO_CHAR(rdate, 'yyyy.mm.dd')
             FROM (SELECT row_number() OVER(ORDER BY cmo DESC)AS rnum, comments.* FROM comments WHERE mno = :mno) comments
             WHERE rnum > :startRow  AND rnum <= :startRow + :size
           ]]>
      </query>
      <mapping>
          <setProperty></setProperty>
          <getProperty>rnum, cmo, mno, id, grade, content, rdate</getProperty>
      </mapping>
  </sql>
  <sql id="listCount">
      <query>
          <![CDATA[
            SELECT COUNT(*) AS total FROM comments WHERE mno = :mno
          ]]>
      </query>
      <mapping>
          <setProperty></setProperty>
          <getProperty>total</getProperty>
      </mapping>
  </sql>
  <sql id="listId">
      <query>
          <![CDATA[
             SELECT COUNT(*) AS cnt FROM comments WHERE id LIKE '${id}' AND mno LIKE :mno
          ]]>
      </query>
      <mapping>
          <setProperty></setProperty>
          <getProperty>cnt</getProperty>
      </mapping>
  </sql>
  <sql id="listReviewRight">
      <query>
          <![CDATA[
            SELECT DISTINCT TO_CHAR(theaterinfo.time, 'HH24:MI'), cdate
            FROM seat
            INNER JOIN theaterinfo ON seat.tino = theaterinfo.tino
            INNER JOIN payment ON seat.randomkey = payment.randomkey
            WHERE seat.id LIKE '${id}' AND mno LIKE :mno
          ]]>
      </query>
      <mapping>
          <setProperty></setProperty>
          <getProperty>theaterinfo.time, cdate</getProperty>
      </mapping>
  </sql>
  </processor-info>
  
  <input>
    <block name="InBlock_1">
        <field name="id" type="string" label="회원아이디"></field>
        <field name="mno" type="string" label="영화번호"></field>
        <field name="startRow" type="int" label="시작행"></field>
        <field name="size" type="int" label="게시글수"></field>
    </block>
  </input>
  
  <output>
    <block name="OutBlock_1">
      <field name="id" type="string" label="회원아이디"></field>
      <field name="mno" type="string" label="영화번호"></field>
      <field name="cmo" type="string" label=" 댓글번호"></field>
      <field name="grade" type="string" label="평점"></field>
      <field name="content" type="string" label="내용"></field>
      <field name="rdate" type="string" label="등록일"></field>
      <field name="total" type="int" label="검색수"></field>
      <field name="cnt" type="int" label="id검색수"></field>
      <field name="rnum" type="int" label="댓글번호"></field>
      <field name="theaterinfo.time" type="string" label="상영시간"></field>
      <field name="cdate" type="string" label="예매일"></field>
    </block>
  </output>  

</transaction>
