<?xml version="1.0" encoding="euc-kr" ?>

<transaction name="readCity" xmlns="http://www.cyber-i.com/xml/bld"
	xmlns:xsi="http://www.w3.org/2001/XMLSchema-instance"
	xsi:schemaLocation="http://www.cyber-i.com/xml/bld   http://www.cyber-i.com/xml/ns/bld-5.0.xsd">
	<info>
		<name>도시 정보 보기</name>
		<description></description>
		<author></author>
		<version></version>
		<http-access>false</http-access>
	</info>

	<processor-info type="dbms" datasource="derbyPool">

		<sql id="query1">
			<query><![CDATA[
      SELECT CITY_ID, CITY_NAME, COUNTRY, AIRPORT, LANGUAGE, COUNTRY_ISO_CODE 
      FROM CITIES WHERE city_id=:id      
      ]]></query>
			<mapping>
				<setProperty></setProperty>
				<getProperty>id,name,country,airport,language,countryIsoCode</getProperty>
			</mapping>
		</sql>

	</processor-info>

	<input>
		<block>
			<field name="id" type="int" />
		</block>
	</input>

	<output>
		<block name="city">
			<field name="id" type="int" />
			<field name="name" type="string" />
			<field name="country" type="string" />
			<field name="airport" type="string" />
			<field name="language" type="string" />
			<field name="countryIsoCode" type="string" />
		</block>
	</output>

</transaction>
